{
  "$schema": "https://json-schema.org/draft/2020-12/schema",
  "$id": "https://github.com/Forenly/uipath-maestro-ecm/blob/main/samples/triggers/incident_report.schema.json",
  "title": "IncidentReport",
  "description": "Canonical shape consumed by Container 1 (Anomaly Intake) for a humanoid RL training fleet. Every source — live reward/loss telemetry, container training logs, a hardware monitor (GPU/thermal/quota), or a researcher console — normalizes its input to this shape before entering the BPMN. The Telemetry Analyst agent, the Researcher Review Board Action Center HITL, and downstream containers all read this object. One record = one training-run anomaly/event.",
  "type": "object",
  "required": ["incidentId", "source", "occurredAt", "severity", "subject", "description"],
  "additionalProperties": false,
  "properties": {
    "incidentId": {
      "type": "string",
      "description": "Stable identifier assigned by the source adapter. Format: `IR-{YYYYMMDD}-{seq}` recommended (IR = Incident Report / run event).",
      "pattern": "^IR-[0-9]{8}-[0-9]{4,}$",
      "examples": ["IR-20260520-0001"]
    },
    "source": {
      "type": "object",
      "description": "Where the anomaly event originated.",
      "required": ["type", "name"],
      "additionalProperties": false,
      "properties": {
        "type": {
          "type": "string",
          "enum": ["telemetry", "logs", "monitor", "manual"],
          "description": "Source category. Determines which adapter normalized the input. `telemetry`=live reward/loss metric stream, `logs`=container/training stdout logs, `monitor`=hardware monitor (GPU utilization/thermal/quota/billing), `manual`=researcher console/form."
        },
        "name": {
          "type": "string",
          "description": "Specific monitor/system name.",
          "examples": ["reward-monitor", "trainer-stdout", "gpu-smi", "researcher-console"]
        },
        "detectorConfidence": {
          "type": "number",
          "minimum": 0,
          "maximum": 1,
          "description": "When applicable (automated detectors), the source's confidence score. Used by the Risk Agent's Fast Track gateway. Omit or set to 1.0 for manual/deterministic sources."
        }
      }
    },
    "occurredAt": {
      "type": "string",
      "format": "date-time",
      "description": "ISO-8601 UTC timestamp when the underlying event occurred (not when the trigger fired the BPMN)."
    },
    "severity": {
      "type": "string",
      "enum": ["info", "low", "medium", "high", "critical"],
      "description": "Initial severity tag from the source. The Risk Agent may revise this in Container 3."
    },
    "subject": {
      "type": "string",
      "minLength": 3,
      "maxLength": 200,
      "description": "Short human-readable headline (e.g., `LOSS_DIVERGENCE: critic loss diverging on run walk-gait-v2`)."
    },
    "description": {
      "type": "string",
      "minLength": 10,
      "description": "Free-form details supplied by the source. May include error codes, observed measurements (reward, loss, gradient norm, GPU temperature), comparison to a healthy baseline, attached evidence URIs."
    },
    "affectedItems": {
      "type": "array",
      "description": "Training jobs / GPU instances / cloud accounts implicated by the anomaly. Drives cloud-provider & cost impact analysis in Container 4.",
      "items": {
        "type": "object",
        "required": ["itemId", "itemType"],
        "additionalProperties": false,
        "properties": {
          "itemId": {
            "type": "string",
            "description": "Training job id, GPU instance id, cluster id, or cloud account id.",
            "examples": ["job-walk-gait-v2", "gpu-h100-07", "amd-mi300x-3"]
          },
          "itemType": {
            "type": "string",
            "enum": ["instance", "job", "gpu", "cluster", "account"]
          },
          "supplierId": {
            "type": "string",
            "description": "Optional cloud-provider / account identifier; populated when a resource is sourced from a specific provider.",
            "examples": ["aws-us-east-1", "gcp-us-central1", "amd-devcloud"]
          },
          "quantity": {
            "type": "number",
            "minimum": 0,
            "description": "Affected quantity or count of instances/jobs in the affected batch."
          }
        }
      }
    },
    "safetyZone": {
      "type": "string",
      "enum": ["none", "high-cost-gpu", "production-bound", "public-benchmark", "long-running", "other"],
      "description": "Criticality zone of the run when the anomaly occurred. Critical zones (high-cost-gpu, production-bound, public-benchmark, long-running) bias the Risk Agent toward Full Track / human review — wasted spend, a model headed for a physical robot, a published benchmark, or a multi-day run all raise the stakes of a wrong autonomous call."
    },
    "evidence": {
      "type": "array",
      "description": "Supporting evidence URIs (reward-curve captures, log excerpts, GPU dashboards).",
      "items": {
        "type": "object",
        "required": ["kind", "uri"],
        "additionalProperties": false,
        "properties": {
          "kind": {
            "type": "string",
            "enum": ["image", "pdf", "log", "report", "video", "other"]
          },
          "uri": {
            "type": "string",
            "format": "uri",
            "description": "Cloud storage or content-addressable URI to the evidence artifact."
          },
          "caption": {
            "type": "string",
            "maxLength": 200
          }
        }
      }
    },
    "reportedBy": {
      "type": "object",
      "description": "Human or system that filed the event (the `Requestor` role in the framework).",
      "required": ["principalType", "principalId"],
      "additionalProperties": false,
      "properties": {
        "principalType": {
          "type": "string",
          "enum": ["human", "service-account", "automated-detector"]
        },
        "principalId": {
          "type": "string",
          "description": "User ID, service account name, or detector instance ID."
        },
        "displayName": {
          "type": "string"
        }
      }
    },
    "tags": {
      "type": "array",
      "description": "Free-form tags used by the Analyst agent for clustering related events.",
      "items": { "type": "string" },
      "examples": [["gradient", "high-cost-gpu", "walk-gait-v2"]]
    },
    "vendor": {
      "type": "object",
      "description": "Source-specific raw payload, preserved verbatim for audit. Adapters MUST NOT mutate; downstream agents may consult.",
      "additionalProperties": true
    }
  }
}
